{"tape":"S-C","title":"S-C: carrier defense, claim and settlement (D2)","provenance":"SYNTHETIC (design numbers)","description":"After an earlier reefer failure, D2 settlement opens. Claims & Recovery files from the deterministic loss basis; the carrier defends with warm loading and offers 80%; the agent rebuts from the causal signatures and recommends accepting inside the policy band. Finance approves both steps; the claim settles and the case is sealed into decision memory.","personas":{"quality":{"user":"BBC_DEMO_QUALITY","role":"BBC_QUALITY_MGR"},"sales":{"user":"BBC_DEMO_SALES","role":"BBC_SALES_MGR"},"finance":{"user":"BBC_DEMO_FINANCE","role":"BBC_FINANCE_MGR"},"auditor":{"user":"BBC_DEMO_AUDITOR","role":"BBC_AUDITOR"},"govadmin":{"user":"BBC_DEMO_GOVADMIN","role":"BBC_GOVERNANCE_ADMIN"}},"frames":[{"label":"D2 settlement: Claims & Recovery is building the carrier claim","inbox":{"quality":[{"case_id":"CASE-00000011","decision_point":"D2","state":"CLAIMS_PENDING","state_version":27,"change_token":"27:304","severity":"HIGH","shipment_id":"SHP-20261003-077","lot_ids":["L-C"],"opened_at":"2026-10-03T21:41:40Z","onset_at":"2026-10-03T21:10:00Z","deadline_ts":"2027-06-30T23:59:00Z","due_at":null,"fallback_at":null,"value_at_risk_usd":21355,"decided_by":null,"evaluation_outcome":null,"autonomy_level":null,"awaiting_roles":[],"awaiting_me":false,"needs_reassessment":false,"inbox_rank":3,"is_open":true,"sealed_at":null,"policy_version":"1","provenance":"LIVE","updated_at":"2026-10-06T09:00:31Z"}],"sales":[{"case_id":"CASE-00000011","decision_point":"D2","state":"CLAIMS_PENDING","state_version":27,"change_token":"27:304","severity":"HIGH","shipment_id":"SHP-20261003-077","lot_ids":["L-C"],"opened_at":"2026-10-03T21:41:40Z","onset_at":"2026-10-03T21:10:00Z","deadline_ts":"2027-06-30T23:59:00Z","due_at":null,"fallback_at":null,"value_at_risk_usd":21355,"decided_by":null,"evaluation_outcome":null,"autonomy_level":null,"awaiting_roles":[],"awaiting_me":false,"needs_reassessment":false,"inbox_rank":3,"is_open":true,"sealed_at":null,"policy_version":"1","provenance":"LIVE","updated_at":"2026-10-06T09:00:31Z"}],"finance":[{"case_id":"CASE-00000011","decision_point":"D2","state":"CLAIMS_PENDING","state_version":27,"change_token":"27:304","severity":"HIGH","shipment_id":"SHP-20261003-077","lot_ids":["L-C"],"opened_at":"2026-10-03T21:41:40Z","onset_at":"2026-10-03T21:10:00Z","deadline_ts":"2027-06-30T23:59:00Z","due_at":null,"fallback_at":null,"value_at_risk_usd":21355,"decided_by":null,"evaluation_outcome":null,"autonomy_level":null,"awaiting_roles":[],"awaiting_me":false,"needs_reassessment":false,"inbox_rank":3,"is_open":true,"sealed_at":null,"policy_version":"1","provenance":"LIVE","updated_at":"2026-10-06T09:00:31Z"}],"auditor":[{"case_id":"CASE-00000011","decision_point":"D2","state":"CLAIMS_PENDING","state_version":27,"change_token":"27:304","severity":"HIGH","shipment_id":"SHP-20261003-077","lot_ids":["L-C"],"opened_at":"2026-10-03T21:41:40Z","onset_at":"2026-10-03T21:10:00Z","deadline_ts":"2027-06-30T23:59:00Z","due_at":null,"fallback_at":null,"value_at_risk_usd":21355,"decided_by":null,"evaluation_outcome":null,"autonomy_level":null,"awaiting_roles":[],"awaiting_me":false,"needs_reassessment":false,"inbox_rank":3,"is_open":true,"sealed_at":null,"policy_version":"1","provenance":"LIVE","updated_at":"2026-10-06T09:00:31Z"}],"govadmin":[{"case_id":"CASE-00000011","decision_point":"D2","state":"CLAIMS_PENDING","state_version":27,"change_token":"27:304","severity":"HIGH","shipment_id":"SHP-20261003-077","lot_ids":["L-C"],"opened_at":"2026-10-03T21:41:40Z","onset_at":"2026-10-03T21:10:00Z","deadline_ts":"2027-06-30T23:59:00Z","due_at":null,"fallback_at":null,"value_at_risk_usd":21355,"decided_by":null,"evaluation_outcome":null,"autonomy_level":null,"awaiting_roles":[],"awaiting_me":false,"needs_reassessment":false,"inbox_rank":3,"is_open":true,"sealed_at":null,"policy_version":"1","provenance":"LIVE","updated_at":"2026-10-06T09:00:31Z"}]},"cases":{"CASE-00000011":{"view":{"view_version":"1","generated_at":"2026-10-06T09:00:31Z","change_token":"27:304","viewer":{"user":"BBC_DEMO_AUDITOR","role":"BBC_AUDITOR","available_actions":[{"action":"VERIFY_LEDGER","enabled":true,"disabled_reason":null},{"action":"REPLAY_EVIDENCE","enabled":true,"disabled_reason":null,"pack_ids":["PACK-00000026","PACK-00000051"]},{"action":"EXPORT_EVIDENCE_PACK","enabled":true,"disabled_reason":null}]},"case":{"case_id":"CASE-00000011","decision_point":"D2","state":"CLAIMS_PENDING","state_version":27,"severity":"HIGH","episode_key":"SHP-20261003-077#2026-10-03T21:10Z","shipment_id":"SHP-20261003-077","onset_at":"2026-10-03T21:10:00Z","detected_at":"2026-10-03T21:41:00Z","opened_at":"2026-10-03T21:41:40Z","opened_by":"SYSTEM","holder_party_id_at_onset":"PARTY-SIERRA","holder_type_at_onset":"CARRIER","policy_version":"1","deadline_ts":"2027-06-30T23:59:00Z","value_at_risk_usd":21355,"current_pack_id":"PACK-00000051","current_rec_id":null,"current_brief_hash":null,"needs_reassessment":false,"provenance":"LIVE","updated_at":"2026-10-06T09:00:31Z","lots":[{"lot_id":"L-C","added_at":"2026-10-03T21:41:40Z","onset_at":"2026-10-03T21:10:00Z","detected_at":"2026-10-03T21:41:00Z","breach_min_at_detection":31,"max_pulp_c":5.1,"holder_party_id_at_onset":"PARTY-SIERRA"}]},"event":{"detection":{"case_id":"CASE-00000011","decision_point":"D1","episode_key":"SHP-20261003-077#2026-10-03T21:10Z","shipment_id":"SHP-20261003-077","severity":"HIGH","onset_at":"2026-10-03T21:10:00Z","holder_party_id_at_onset":"PARTY-SIERRA","holder_type_at_onset":"CARRIER","lots":[{"lot_id":"L-C","onset_at":"2026-10-03T21:10:00Z","detected_at":"2026-10-03T21:41:00Z","breach_min_in_window":31,"max_pulp_c":5.1,"holder_party_id_at_onset":"PARTY-SIERRA"}],"rule":{"detection_window_min":60,"tolerance_min":30,"threshold_c":1.8,"policy_version":"1"},"run_id":"DET-20261003-2141"}},"analysis":{"pack":{"pack_id":"PACK-00000051","case_id":"CASE-00000011","decision_point":"D2","revision":1,"as_of":"2026-10-06T09:00:00Z","sealed_at":"2026-10-06T09:00:09Z","param_versions":{"policy":"1","semantic":"1","engine":"0.1.0","products":"1","contracts":"1","prices":"1","cost_rates":"1","lanes":"1"},"shipment":{"shipment_id":"SHP-20261003-077","carrier_party_id":"PARTY-SIERRA","reefer_device_id":"RF-114","origin_site_id":"SITE-EMERALD-PACK","destination_site_id":"SITE-SUMMIT-SLC","bol_setpoint_c":0.5,"state_at_as_of":"DELIVERED","next_junction_site_id":"SITE-JCT-I80-SAC","eta_p50_at":"2026-10-07T06:00:00Z","eta_p90_at":"2026-10-07T08:00:00Z","reefer_state":{"as_of":"2026-10-06T07:50:00Z","mode":"CONTINUOUS","alarms":["COMPRESSOR_FAULT"],"supply_air_c":14.2,"return_air_c":13.1,"setpoint_c":0.5},"evidence_id":"EV:PACK:PACK-00000051#/shipment"},"lots":[{"lot_id":"L-C","product_id":"BB-EMERALD-ORG-12x6","organic":true,"kg":4200,"planned_value_usd":47040,"grower_party_id":"PARTY-EMERALD-RIDGE","harvest_at":"2026-10-05T13:00:00Z","primary_probe_device_id":"P-A1","proxy_air_only":false,"last_pulp_c":4.6,"last_reading_at":"2026-10-06T07:54:00Z","food_safety_flag":false,"model_validity":"IN_RANGE","sigma_days":0.8,"values":[{"name":"REMAINING_SHELF_LIFE_DAYS","value":9,"unit":"days","grain":"lot","as_of":"2026-10-06T07:54:00Z","data_age_min":1,"freshness":"OK","metric_version":"1","evidence_id":"EV:PACK:PACK-00000051#/lots/0/values/0"},{"name":"MONITORING_COVERAGE_PCT","value":96,"unit":"%","grain":"lot","as_of":"2026-10-06T07:54:00Z","data_age_min":1,"freshness":"OK","metric_version":"1","evidence_id":"EV:PACK:PACK-00000051#/lots/0/values/1"},{"name":"VALUE_AT_RISK_USD","value":21355,"unit":"USD","grain":"case_lot","as_of":"2026-10-06T07:55:00Z","data_age_min":0,"freshness":"OK","metric_version":"1","evidence_id":"EV:PACK:PACK-00000051#/lots/0/values/2"}],"custody_exposure":[{"holder_party_id":"PARTY-SIERRA","holder_type":"CARRIER","excess_life_share":0.82,"thermal_exposure_deg_h":22.8,"breach_min":228,"evidence_id":"EV:PACK:PACK-00000051#/lots/0/custody_exposure/0"},{"holder_party_id":"PARTY-EMERALD-RIDGE","holder_type":"PACKHOUSE","excess_life_share":0.18,"thermal_exposure_deg_h":4.9,"breach_min":40,"evidence_id":"EV:PACK:PACK-00000051#/lots/0/custody_exposure/1"}]}],"custody_timeline":[{"party_id":"PARTY-EMERALD-RIDGE","holder_type":"PACKHOUSE","site_id":"SITE-EMERALD-PACK","from_at":"2026-10-05T13:00:00Z","to_at":"2026-10-06T02:00:00Z","evidence_id":"EV:PACK:PACK-00000051#/custody_timeline/0"},{"party_id":"PARTY-SIERRA","holder_type":"CARRIER","site_id":null,"from_at":"2026-10-06T02:00:00Z","to_at":null,"evidence_id":"EV:PACK:PACK-00000051#/custody_timeline/1"}],"affected_order_lines":[],"candidate_inventory":[],"candidate_destinations":[],"documents":[{"doc_id":"DOC-SFI-044812","doc_type":"INSPECTION_CERT","sha256":"9c1d8e2f4a6b3c5d7e9f1a2b4c6d8e0f2a4b6c8d0e2f4a6b8c0d2e4f6a8b0c2d","received_at":"2026-10-06T03:10:00Z","claims":[{"claim_key":"pulp_temp_at_loading_c","value":1,"unit":"C","claimed_at":"2026-10-06T01:40:00Z","consistency":{"verdict":"CONSISTENT","sensor_value":0.9,"delta":0.1,"rule_id":"TEMP_AT_TIME@1"},"evidence_id":"EV:DOC:DOC-SFI-044812#pulp_temp_at_loading_c"}]}],"inspection_sites":[],"data_gaps":[],"deadline_inputs":{"windows":[]},"content_hash":"93e6a01edc7ee1922b2e30ae7ccadb4682f603d4294dbd049950da9ac9aec700"},"packs":[{"pack_id":"PACK-00000026","decision_point":"D1","revision":1,"as_of":"2026-10-03T21:42:00Z","sealed_at":"2026-10-03T21:42:11Z","content_hash":"ca615adb2ab49cca9cd0c7e8f52e21d659f8dd4edba88f1ef2691d478c0d73dc"},{"pack_id":"PACK-00000051","decision_point":"D2","revision":1,"as_of":"2026-10-06T09:00:00Z","sealed_at":"2026-10-06T09:00:09Z","content_hash":"93e6a01edc7ee1922b2e30ae7ccadb4682f603d4294dbd049950da9ac9aec700"}],"thermal":[],"findings":[]},"options":[{"option_id":"OPT-00000210","case_id":"CASE-00000011","decision_point":"D2","option_set_rev":1,"origin":"GENERATOR","parent_option_id":null,"label":"File the full claim against Sierra Cold Freight ($21,355)","is_default":fa